<?xml version="1.0" encoding="UTF-8"?>
<!-- A purchase order valid against purchaseOrder.xsd and passing every rule of schematron/purchaseOrder.sch.
     To see the rules fire: set a quantity to 100, drop the comment of the expensive item, or ship an item before the order date. -->
<po:purchaseOrder xmlns:po="http://example.com/po"
                  xmlns:xsi="http://www.w3.org/2001/XMLSchema-instance"
                  xsi:schemaLocation="http://example.com/po purchaseOrder.xsd"
                  orderDate="2026-09-01" createdBy="alice" po:version="1.0">
  <po:shipTo country="US">
    <po:name>Alice Smith</po:name>
    <po:street>123 Maple Street</po:street>
    <po:city>Mill Valley</po:city>
    <po:state>CA</po:state>
    <po:zip>90952</po:zip>
  </po:shipTo>
  <po:billTo country="US">
    <po:name>Robert Smith</po:name>
    <po:street>8 Oak Avenue</po:street>
    <po:city>Old Town</po:city>
    <po:state>PA</po:state>
    <po:zip>95819</po:zip>
  </po:billTo>
  <po:comment>Hurry, my lawn is going wild!</po:comment>
  <po:items>
    <po:item partNum="872-AA">
      <po:productName>Lawnmower</po:productName>
      <po:quantity>1</po:quantity>
      <po:USPrice>1480.00</po:USPrice>
      <po:comment>Confirm this is electric</po:comment>
      <po:shipDate>2026-09-03</po:shipDate>
    </po:item>
    <po:item partNum="926-AA">
      <po:productName>Baby Monitor</po:productName>
      <po:quantity>2</po:quantity>
      <po:USPrice>39.98</po:USPrice>
      <po:shipDate>2026-09-05</po:shipDate>
      <po:giftWrap>true</po:giftWrap>
      <po:giftMessage>For the new arrival</po:giftMessage>
    </po:item>
  </po:items>
</po:purchaseOrder>
